{
  "operationReportId": "507f****************9011",
  "products": {
    "inserted": 1,
    "updated": 0,
    "deleted": 0,
    "ignored": 0
  },
  "modifiers": {
    "inserted": 6,
    "updated": 0,
    "deleted": 0,
    "ignored": 0
  },
  "modifierGroups": {
    "inserted": 2,
    "updated": 0,
    "deleted": 0,
    "ignored": 0
  },
  "bundles": {
    "inserted": 0,
    "updated": 0,
    "deleted": 0,
    "ignored": 0
  },
  "priceLevels": 0,
  "warnings": 0,
  "errors": 0
}